{"schema_version":"foigent.integration-campaign-authorization-trust-set.v1","purpose":"integration_campaign_authorization","domain":"foigent.integration-campaign-authorization.v1","trust_set_ref":"integration-authorization-trust-fixture-01","keys":[{"signing_key_ref":"integration-authorization-fixture-01","signer_public_key_id":"ed25519:sha256:e88b49f7b0c9b9f35951b7c243e733cd60076f6b76152795286241de0b463f8e","algorithm":"ed25519","public_key":"/kcX6zQTTXZVk9BiYJQ3hDt6Jp7L70VYJfzuuovMCwA=","status":"active","valid_from":"2029-01-01T00:00:00Z","valid_until":"2031-01-01T00:00:00Z"}]}